{
  "schemaVersion": "1.0.0",
  "generatedAt": "2026-09-23T18:31:42Z",
  "commitSha": "f73dfd9dd70144de09d1ea66386d498b834636f7",
  "kits": [
    {
      "$schema": "../../docs/schemas/starter-kit-schema.json",
      "name": "chemistry-and-materials",
      "version": "1.0.0",
      "description": "Chemistry and materials science workbench spanning cheminformatics, retrosynthesis, docking, quantum chemistry, molecular dynamics, and generative materials design.",
      "displayName": "Chemistry and Materials",
      "longDescription": "# Chemistry and Materials\n\nA comprehensive starter kit for chemistry and materials science research that combines cheminformatics, retrosynthetic planning, molecular docking, quantum chemistry, classical and ab-initio molecular dynamics, and generative materials design.\n\n**What you can do:**\n- Plan retrosynthetic routes for organic molecules\n- Search chemical and natural-product databases\n- Dock small molecules against protein targets\n- Run DFT, ab-initio MD, and conformer searches\n- Run classical molecular dynamics with GROMACS, LAMMPS, and OpenMM\n- Generate novel inorganic materials and analyze functional groups\n\n**Ideal for:** computational chemists, medicinal chemists, materials scientists, and catalysis researchers.",
      "author": {
        "name": "Microsoft",
        "email": "discovery-catalog@microsoft.com",
        "url": "https://github.com/microsoft/discovery"
      },
      "license": "MIT",
      "keywords": [
        "chemistry",
        "materials science",
        "cheminformatics",
        "retrosynthesis",
        "quantum chemistry",
        "molecular dynamics",
        "drug discovery",
        "generative design"
      ],
      "category": "Chemistry",
      "homepage": "https://github.com/microsoft/discovery/tree/main/starter-kits/chemistry-and-materials",
      "party": "1p",
      "lifecycle": "active",
      "agentRefs": [
        {
          "ref": "agents/aizynthfinder",
          "role": "primary",
          "required": true,
          "description": "Retrosynthetic planning for organic molecules.",
          "agentMeta": {
            "name": "aizynthfinder",
            "displayName": "AiZynthFinder",
            "version": "1.0.0",
            "tags": [
              "retrosynthesis",
              "drug-discovery",
              "trained-model"
            ],
            "description": "Expert agent for retrosynthetic route planning using AiZynthFinder. Breaks down target drug-like molecules into purchasable precursors using neural-network-guided MCTS with USPTO reaction templates.\n"
          }
        },
        {
          "ref": "agents/autodock",
          "role": "supporting",
          "required": false,
          "description": "Molecular docking of small-molecule ligands to protein targets.",
          "agentMeta": {
            "name": "autodock",
            "displayName": "AutoDock Vina",
            "version": "1.0.0",
            "tags": [
              "molecule-docking",
              "drug-discovery",
              "virtual-screening"
            ],
            "description": "Expert molecular docking agent using AutoDock Vina for protein-ligand binding affinity prediction, virtual screening, and structure-based drug design.\n"
          }
        },
        {
          "ref": "agents/bindingdb",
          "role": "supporting",
          "required": false,
          "description": "Search BindingDB for measured protein-ligand binding affinities.",
          "agentMeta": {
            "name": "bindingdb",
            "displayName": "BindingDB",
            "version": "1.0.0",
            "tags": [
              "binding-affinity",
              "drug-discovery",
              "database"
            ],
            "description": "BindingDB agent for retrieving comprehensive binding affinity data for protein-ligand interactions. Provides access to local SQLite database with sub-millisecond query performance.\n"
          }
        },
        {
          "ref": "agents/chemberta",
          "role": "supporting",
          "required": false,
          "description": "ChemBERTa embeddings and predictions for molecules.",
          "agentMeta": {
            "name": "chemberta",
            "displayName": "ChemBERTa",
            "version": "1.0.0",
            "tags": [
              "cheminformatics",
              "molecular-property-prediction",
              "trained-model",
              "transformer"
            ],
            "description": "Molecular property prediction agent using ChemBERTa-2 transformer. Provides SMILES-based molecular embeddings, classification and regression fine-tuning, SMILES augmentation, confidence scoring, similarity search, and clustering.\n"
          }
        },
        {
          "ref": "agents/chembl",
          "role": "supporting",
          "required": false,
          "description": "Query ChEMBL for bioactivity, targets, and assays.",
          "agentMeta": {
            "name": "chembl",
            "displayName": "ChEMBL",
            "version": "1.0.0",
            "tags": [
              "cheminformatics",
              "bioactivity",
              "database"
            ],
            "description": "ChEMBL agent for retrieving chemical and bioactivity data from the ChEMBL database. Provides access to compound information, target data, bioactivity measurements, and cross-references with PDB structures.\n"
          }
        },
        {
          "ref": "agents/chemprop",
          "role": "supporting",
          "required": false,
          "description": "Train and apply Chemprop message-passing neural networks.",
          "agentMeta": {
            "name": "chemprop",
            "displayName": "Chemprop",
            "version": "1.0.0",
            "tags": [
              "molecular-properties",
              "trained-model",
              "d-mpnn",
              "property-prediction"
            ],
            "description": "Expert agent for molecular property prediction using Chemprop v2 (D-MPNN). Trains, evaluates, and deploys message-passing neural networks for regression, classification, and multi-task molecular property prediction.\n"
          }
        },
        {
          "ref": "agents/coconut",
          "role": "supporting",
          "required": false,
          "description": "Search the COCONUT natural products database.",
          "agentMeta": {
            "name": "coconut",
            "displayName": "COCONUT",
            "version": "1.0.0",
            "tags": [
              "cheminformatics",
              "natural-products",
              "database"
            ],
            "description": "Agent for searching and retrieving natural product structures from the COCONUT (Collection of Open Natural Products) database. Provides access to natural product chemical data, molecular properties, and taxonomic classifications.\n"
          }
        },
        {
          "ref": "agents/cp2k",
          "role": "supporting",
          "required": false,
          "description": "Run CP2K DFT and ab-initio molecular dynamics calculations.",
          "agentMeta": {
            "name": "cp2k",
            "displayName": "CP2K",
            "version": "1.0.0",
            "tags": [
              "quantum-chemistry",
              "materials-science",
              "dft"
            ],
            "description": "Expert agent for atomistic simulations using CP2K. Designs and executes DFT calculations with geometry optimization, ab initio MD, vibrational analysis, band structure, NEB, and semi-empirical methods.\n"
          }
        },
        {
          "ref": "agents/crest",
          "role": "supporting",
          "required": false,
          "description": "Conformer-rotamer sampling with CREST.",
          "agentMeta": {
            "name": "crest",
            "displayName": "CREST",
            "version": "1.0.0",
            "tags": [
              "conformational-search",
              "semiempirical"
            ],
            "description": "Expert agent for conformational sampling and molecular chemical space exploration using CREST 3.0 with GFN-xTB semiempirical methods.\n"
          }
        },
        {
          "ref": "agents/gromacs",
          "role": "supporting",
          "required": false,
          "description": "Run GROMACS molecular dynamics simulations.",
          "agentMeta": {
            "name": "gromacs",
            "displayName": "GROMACS",
            "version": "1.0.0",
            "tags": [
              "molecular-dynamics"
            ],
            "description": "Python code environment with Gromacs tool for high-performance molecular dynamics (MD) simulations.\n"
          }
        },
        {
          "ref": "agents/lammps",
          "role": "supporting",
          "required": false,
          "description": "Run LAMMPS classical molecular dynamics simulations.",
          "agentMeta": {
            "name": "lammps",
            "displayName": "LAMMPS CPU",
            "version": "1.0.0",
            "tags": [
              "molecular-dynamics",
              "materials-science"
            ],
            "description": "Agent for orchestrating LAMMPS CPU tool for molecular simulations. Includes MDAnalysis, ASE, freud, and pandas for self-sufficient trajectory analysis and structure manipulation.\n"
          }
        },
        {
          "ref": "agents/janus",
          "role": "supporting",
          "required": false,
          "description": "Janus generative molecular design.",
          "agentMeta": {
            "name": "janus",
            "displayName": "De Novo Molecule Generator (powered by JANUS)",
            "version": "1.0.0",
            "tags": [
              "molecular-design",
              "generative",
              "de-novo",
              "selfies",
              "inverse-design",
              "genetic-algorithm",
              "materials-discovery"
            ],